{
  "schema_version": "1.0",
  "proposal_id": "RESP-AUDIO-M4A-G1B-CANDIDATES-001",
  "status": "PROPOSED_NOT_AUTHORIZED",
  "language": "zh-TW",
  "core_gate1a": {
    "delivery_id": "DELIVERY-AUDIO-POC-M4A-G1A-PLANNING-ACK-001",
    "branch": "dev_agent_m4",
    "commit": "e3d25d1fc70d726d5bd3162cdcb9571b30937587",
    "path": "docs/outsource/deliveries/DELIVERY-AUDIO-POC-M4A-G1A-PLANNING-ACK-001.md"
  },
  "poc_binding": {
    "branch": "dev_audio_m2",
    "proposal_commit": null
  },
  "controlled_artifact_policy": {
    "tracked_in_git": false,
    "locator_prefix": "controlled://audio-poc/gate1b/",
    "permitted_actions": [
      "download immutable provenance inputs",
      "read or unpack identity, license, notice, and dependency metadata",
      "compute file size and SHA-256"
    ],
    "prohibited_actions": [
      "build, install, import, load, or execute a real candidate",
      "run inference, benchmark, Pi, HAL, or User scoring",
      "commit source archives, models, voices, wheels, shared objects, or raw audio"
    ]
  },
  "candidates": [
    {
      "candidate_id": "vad-silero-onnx-6.2.1",
      "domain": "vad",
      "origin": "core_baseline",
      "requested_disposition": "REQUEST_DEFER",
      "decision_reason": "Exact source and embedded ONNX are fixed, but the Python 3.13 aarch64 onnxruntime transitive wheel closure is not yet immutable; request deferral instead of implying build eligibility.",
      "engine": {
        "name": "silero-vad",
        "version": "6.2.1",
        "upstream_url": "https://github.com/snakers4/silero-vad/commit/7e30209a3e901f9842f81b225f3e93d8199902b1",
        "immutable_revision": "git:7e30209a3e901f9842f81b225f3e93d8199902b1",
        "source_sha256": "9fbbf121ebf042e240aeb48c5fc11bd02cdb869592103556d152c9ba423548a6",
        "source_size_bytes": 28926301,
        "source_acquired_at_utc": "2026-08-17T14:48:21Z",
        "source_controlled_locator": "controlled://audio-poc/gate1b/sources/silero-vad-v6.2.1.tar.gz",
        "license": "MIT",
        "notice": "Repository LICENSE; source snapshot is a POC-generated git archive of the exact commit."
      },
      "artifacts": [
        {
          "role": "vad-model-onnx",
          "filename": "silero_vad.onnx",
          "url": "https://raw.githubusercontent.com/snakers4/silero-vad/7e30209a3e901f9842f81b225f3e93d8199902b1/src/silero_vad/data/silero_vad.onnx",
          "immutable_revision": "git:7e30209a3e901f9842f81b225f3e93d8199902b1:path:src/silero_vad/data/silero_vad.onnx",
          "sha256": "1a153a22f4509e292a94e67d6f9b85e8deb25b4988682b7e174c65279d8788e3",
          "size_bytes": 2327524,
          "acquired_at_utc": "2026-08-17T14:48:21Z",
          "license": "MIT",
          "notice": "Covered by the repository LICENSE; no separate model notice was found in the exact source tree.",
          "controlled_locator": "controlled://audio-poc/gate1b/models/silero_vad.onnx"
        }
      ],
      "dependencies": {
        "status": "OPEN_TRANSITIVE_WHEEL_LOCK",
        "runtime": ["onnxruntime>=1.16.1 (upstream optional onnx-cpu extra)"],
        "build": [],
        "native": ["onnxruntime CPU execution provider and its declared native libraries"]
      },
      "aarch64_build_proposal": {
        "platform": "Raspberry Pi 5 / Debian 13 / aarch64 / Python 3.13",
        "status": "NOT_EXECUTED_GATE_1B",
        "recipe": [
          "Acquire and hash a Python 3.13 aarch64 onnxruntime wheel plus its complete wheel closure.",
          "Create an isolated environment and install only from the controlled wheel directory with pip --no-index.",
          "Use the source-embedded ONNX directly; do not import the silero_vad Python package or pull torch."
        ],
        "network_policy": "offline_from_hashed_inputs"
      },
      "native_contract": {
        "status": "DECLARED_UNVERIFIED_GATE_1B",
        "input": "16 kHz mono float32 windows of 512 samples; the POC adapter buffers frozen 20 ms mono S16_LE frames without resampling.",
        "output": "speech probability per 512-sample window; the frozen endpoint state machine remains outside the model."
      },
      "offline_cache": {
        "status": "PROPOSED_MODEL_PATH_ONLY_NO_RUNTIME_FETCH",
        "locator": "controlled://audio-poc/gate1b/models/silero_vad.onnx"
      },
      "risks": ["onnxruntime aarch64/Python 3.13 closure is unresolved", "512-sample windowing must not alter frozen endpoint timing"]
    },
    {
      "candidate_id": "vad-webrtc-2.0.10",
      "domain": "vad",
      "origin": "core_baseline",
      "requested_disposition": "REQUEST_AUTHORIZE",
      "decision_reason": "The MIT source distribution vendors the C VAD implementation, declares no runtime dependency, and has a bounded source-build proposal for the target.",
      "engine": {
        "name": "py-webrtcvad",
        "version": "2.0.10",
        "upstream_url": "https://pypi.org/project/webrtcvad/2.0.10/",
        "immutable_revision": "pypi:webrtcvad==2.0.10",
        "source_sha256": "f1bed2fb25b63fb7b1a55d64090c993c9c9167b28485ae0bcdd81cf6ede96aea",
        "source_size_bytes": 66156,
        "source_acquired_at_utc": "2026-08-17T14:45:29Z",
        "source_controlled_locator": "controlled://audio-poc/gate1b/sources/webrtcvad-2.0.10.tar.gz",
        "license": "MIT",
        "notice": "PKG-INFO and LICENSE in the source distribution."
      },
      "artifacts": [
        {
          "role": "vendored-runtime-source",
          "filename": "webrtcvad-2.0.10.tar.gz",
          "url": "https://files.pythonhosted.org/packages/89/34/e2de2d97f3288512b9ea56f92e7452f8207eb5a0096500badf9dfd48f5e6/webrtcvad-2.0.10.tar.gz",
          "immutable_revision": "pypi:webrtcvad==2.0.10",
          "sha256": "f1bed2fb25b63fb7b1a55d64090c993c9c9167b28485ae0bcdd81cf6ede96aea",
          "size_bytes": 66156,
          "acquired_at_utc": "2026-08-17T14:45:29Z",
          "license": "MIT",
          "notice": "Source distribution includes LICENSE; Google WebRTC-derived C source is vendored.",
          "controlled_locator": "controlled://audio-poc/gate1b/sources/webrtcvad-2.0.10.tar.gz"
        }
      ],
      "dependencies": {
        "status": "DECLARED_CLOSED_FOR_PROPOSAL",
        "runtime": [],
        "build": ["Debian build-essential", "Python 3.13 headers", "setuptools build backend"],
        "native": ["vendored WebRTC signal-processing and VAD C sources"]
      },
      "aarch64_build_proposal": {
        "platform": "Raspberry Pi 5 / Debian 13 / aarch64 / Python 3.13",
        "status": "NOT_EXECUTED_GATE_1B",
        "recipe": [
          "Build a wheel from the exact sdist in an isolated disposable environment using a hashed setuptools build input.",
          "Install the resulting local wheel with pip --no-index and record its new POC SHA-256 before any import."
        ],
        "network_policy": "offline_from_hashed_inputs"
      },
      "native_contract": {
        "status": "DECLARED_UNVERIFIED_GATE_1B",
        "input": "16 kHz mono S16_LE, exactly 10/20/30 ms; use frozen 20 ms / 320-sample frames.",
        "output": "Boolean speech observation per frame; frozen endpoint state machine remains external."
      },
      "offline_cache": {
        "status": "PROPOSED_NO_MODEL_OR_RUNTIME_DOWNLOAD",
        "locator": "controlled://audio-poc/gate1b/sources/webrtcvad-2.0.10.tar.gz"
      },
      "risks": ["upstream release is old", "Python 3.13 compile compatibility is unverified until Gate 1B ACK"]
    },
    {
      "candidate_id": "asr-whispercpp-base-q5_1-1.9.2",
      "domain": "asr",
      "origin": "core_baseline",
      "requested_disposition": "REQUEST_AUTHORIZE",
      "decision_reason": "Exact MIT engine commit and multilingual quantized model are fixed; the source build can disable network-fetched and host-specific optional backends.",
      "engine": {
        "name": "whisper.cpp",
        "version": "1.9.2",
        "upstream_url": "https://github.com/ggml-org/whisper.cpp/commit/306c88f4d1286aec1bf96e544632897886af5501",
        "immutable_revision": "git:306c88f4d1286aec1bf96e544632897886af5501",
        "source_sha256": "988945d81af6abcf52d5e8034f516c74ffc61057c32c3a4b84f3451c2c7e5e47",
        "source_size_bytes": 9613762,
        "source_acquired_at_utc": "2026-08-17T14:49:45Z",
        "source_controlled_locator": "controlled://audio-poc/gate1b/sources/whisper.cpp-v1.9.2.tar.gz",
        "license": "MIT",
        "notice": "Repository LICENSE; source snapshot is a POC-generated git archive of the exact commit."
      },
      "artifacts": [
        {
          "role": "multilingual-asr-model-q5_1",
          "filename": "ggml-base-q5_1.bin",
          "url": "https://huggingface.co/ggerganov/whisper.cpp/resolve/5359861c739e955e79d9a303bcbc70fb988958b1/ggml-base-q5_1.bin",
          "immutable_revision": "hf:ggerganov/whisper.cpp@5359861c739e955e79d9a303bcbc70fb988958b1",
          "sha256": "422f1ae452ade6f30a004d7e5c6a43195e4433bc370bf23fac9cc591f01a8898",
          "size_bytes": 59707625,
          "acquired_at_utc": "2026-08-17T14:53:23Z",
          "license": "MIT repository notice; upstream Whisper model/data lineage requires final notice review",
          "notice": "Model repository LICENSE plus whisper.cpp model documentation; do not infer commercial clearance from acquisition.",
          "controlled_locator": "controlled://audio-poc/gate1b/models/ggml-base-q5_1.bin"
        }
      ],
      "dependencies": {
        "status": "DECLARED_CLOSED_FOR_MINIMAL_CPU_BUILD",
        "runtime": [],
        "build": ["Debian cmake", "ninja-build or make", "g++", "pthread"],
        "native": ["ggml sources vendored in exact repository; BLAS, CUDA, Vulkan, OpenCL, RPC and network model download disabled"]
      },
      "aarch64_build_proposal": {
        "platform": "Raspberry Pi 5 / Debian 13 / aarch64 / Python 3.13",
        "status": "NOT_EXECUTED_GATE_1B",
        "recipe": [